<?xml version="1.0" encoding="utf-8"?>
<!DOCTYPE competition PUBLIC "-//CHORUSROOM//DTD Contest JCA 1.0//JA" "http://localhost/DTD/jca-comp-result.dtd">
<competition xmlns:cr="http://www.chorusroom.org/character" xmlns:p="http://www.chorusroom.org/piece" xmlns="http://www.chorusroom.org/xml">
<cvs-id>$Id: shizuoka.xml,v 1.13 2002/06/18 15:21:36 kunishi Exp $</cvs-id>
<competition-name pref="true" area="false">第51回全日本合唱コンクール静岡県大会</competition-name>
<result output="shizuoka">
<date day-of-week="sun" holiday="false">1998-09-13</date>
<reporter anonymous="false">
<reporter-name>早川徳次</reporter-name>
<reporter-email anonymous="false">tokuji@emi.yamaha.co.jp</reporter-email>
</reporter>
<notices>
<notice>同一賞内は出演順です。金賞受賞団体が関東支部大会に出場いたします。</notice>
</notices>
<section>
<section-name>一般の部</section-name>
<choir representative="true" seed="false">
<choir-name>静岡合唱団</choir-name>
<choir-type>mixed</choir-type>
<number-of-members>38</number-of-members>
<prize nickname="gold">金賞</prize>
<program>
<given-program>
<pieceRef number="G1" href="givenPrograms-51st.xml"/>
</given-program>
<free-program>
<p:suite>
<p:composed-by>三善晃</p:composed-by>
<p:title original="true" xml:lang="ja">
<p:mainTitle>嫁ぐ娘に</p:mainTitle>
</p:title>
<p:suite-piece>
<p:piece>
<p:title original="true" xml:lang="ja">
<p:mainTitle>戦いの日々</p:mainTitle>
</p:title>
</p:piece>
</p:suite-piece>
<p:suite-piece>
<p:piece>
<p:title original="true" xml:lang="ja">
<p:mainTitle>かどで</p:mainTitle>
</p:title>
</p:piece>
</p:suite-piece>
</p:suite>
</free-program>
</program>
</choir>
<choir representative="true" seed="false">
<choir-name>アルス・アンティカ</choir-name>
<choir-type>mixed</choir-type>
<number-of-members>18</number-of-members>
<prize nickname="gold">金賞</prize>
<program>
<given-program>
<pieceRef number="G1" href="givenPrograms-51st.xml"/>
</given-program>
<free-program>
<p:suite>
<p:composed-by>Victoria</p:composed-by>
<p:title original="true">
<p:mainTitle>Missa Pro Defunctis</p:mainTitle>
</p:title>
<p:suite-piece>
<p:piece>
<p:title original="true">
<p:mainTitle>Kyrie</p:mainTitle>
</p:title>
</p:piece>
</p:suite-piece>
</p:suite>
</free-program>
<free-program>
<p:piece>
<p:composed-by>Pilkington</p:composed-by>
<p:title original="true">
<p:mainTitle>The Messenger Of Spring</p:mainTitle>
</p:title>
</p:piece>
</free-program>
</program>
</choir>
<choir representative="true" seed="false">
<choir-name>浜松合唱団</choir-name>
<choir-type>mixed</choir-type>
<number-of-members>45</number-of-members>
<prize nickname="gold">金賞</prize>
<special-prize>全日本合唱連盟理事長賞</special-prize>
<program>
<given-program>
<pieceRef number="G4" href="givenPrograms-51st.xml"/>
</given-program>
<free-program>
<p:piece>
<p:composed-by>J. Karai</p:composed-by>
<p:title original="true">
<p:mainTitle>Stabat Mater</p:mainTitle>
</p:title>
</p:piece>
</free-program>
</program>
</choir>
<choir representative="false" seed="false">
<choir-name>浜松フラウエンコール</choir-name>
<choir-type>female</choir-type>
<number-of-members>28</number-of-members>
<prize nickname="silver">銀賞</prize>
<program>
<given-program>
<pieceRef number="F3" href="givenPrograms-51st.xml"/>
</given-program>
<free-program>
<p:piece>
<p:composed-by>A. Heiler</p:composed-by>
<p:title original="true">
<p:mainTitle>Kyrie</p:mainTitle>
</p:title>
</p:piece>
</free-program>
<free-program>
<p:piece>
<p:composed-by>A. Heiler</p:composed-by>
<p:title original="true">
<p:mainTitle>Gloria</p:mainTitle>
</p:title>
</p:piece>
</free-program>
</program>
</choir>
<choir representative="false" seed="false">
<choir-name>VOX POPULI</choir-name>
<choir-type>mixed</choir-type>
<number-of-members>18</number-of-members>
<prize nickname="silver">銀賞</prize>
<program>
<given-program>
<pieceRef number="G1" href="givenPrograms-51st.xml"/>
</given-program>
<free-program>
<p:suite>
<p:composed-by>A. Copland</p:composed-by>
<p:title original="true">
<p:mainTitle>Four Motets</p:mainTitle>
</p:title>
<p:suite-piece>
<p:piece>
<p:title original="true">
<p:mainTitle>Help Us Lord</p:mainTitle>
</p:title>
</p:piece>
</p:suite-piece>
<p:suite-piece>
<p:piece>
<p:title original="true">
<p:mainTitle>Thou O Jehovah</p:mainTitle>
</p:title>
</p:piece>
</p:suite-piece>
<p:suite-piece>
<p:piece>
<p:title original="true">
<p:mainTitle>Abideth Forever</p:mainTitle>
</p:title>
</p:piece>
</p:suite-piece>
</p:suite>
</free-program>
</program>
</choir>
<choir representative="false" seed="false">
<choir-name>キンダーコーア花輝</choir-name>
<choir-type>children</choir-type>
<number-of-members>15</number-of-members>
<prize nickname="blonze">銅賞</prize>
<program>
<given-program>
<pieceRef number="F2" href="givenPrograms-51st.xml"/>
</given-program>
<free-program>
<p:suite>
<p:composed-by>Ziegler</p:composed-by>
<p:title original="true" xml:lang="ja">
<p:mainTitle>大地への祈り</p:mainTitle>
</p:title>
<p:suite-piece>
<p:piece>
<p:title original="true">
<p:mainTitle>Alleluja</p:mainTitle>
</p:title>
</p:piece>
</p:suite-piece>
<p:suite-piece>
<p:piece>
<p:title original="true">
<p:mainTitle>Kyrie</p:mainTitle>
</p:title>
</p:piece>
</p:suite-piece>
<p:suite-piece>
<p:piece>
<p:title original="true">
<p:mainTitle>Gloria</p:mainTitle>
</p:title>
</p:piece>
</p:suite-piece>
<p:suite-piece>
<p:piece>
<p:title original="true">
<p:mainTitle>Agnus Dei</p:mainTitle>
</p:title>
</p:piece>
</p:suite-piece>
</p:suite>
</free-program>
</program>
</choir>
</section>
<section>
<section-name>職場の部</section-name>
<choir representative="true" seed="false">
<choir-name>YAMAHA Chamber Choir</choir-name>
<choir-type>male</choir-type>
<number-of-members>12</number-of-members>
<prize nickname="gold">金賞</prize>
<program>
<given-program>
<pieceRef number="M1" href="givenPrograms-51st.xml"/>
</given-program>
<free-program>
<p:suite>
<p:composed-by>Gustafson</p:composed-by>
<p:title original="true">
<p:mainTitle>Missa a capella</p:mainTitle>
</p:title>
<p:suite-piece>
<p:piece>
<p:title original="true">
<p:mainTitle>Kyrie</p:mainTitle>
</p:title>
</p:piece>
</p:suite-piece>
<p:suite-piece>
<p:piece>
<p:title original="true">
<p:mainTitle>Gloria</p:mainTitle>
</p:title>
</p:piece>
</p:suite-piece>
<p:suite-piece>
<p:piece>
<p:title original="true">
<p:mainTitle>Agnus Dei</p:mainTitle>
</p:title>
</p:piece>
</p:suite-piece>
</p:suite>
</free-program>
</program>
</choir>
<section-name>大学の部</section-name>
<choir representative="true" seed="false">
<choir-name>静岡大学</choir-name>
<choir-type>mixed</choir-type>
<number-of-members>59</number-of-members>
<prize nickname="seeded">シード</prize>
<program>
<given-program>
<pieceRef number="G1" href="givenPrograms-51st.xml"/>
</given-program>
<free-program>
<p:suite>
<p:composed-by>三善晃</p:composed-by>
<p:title original="true" xml:lang="ja">
<p:mainTitle>嫁ぐ娘に</p:mainTitle>
</p:title>
<p:suite-piece>
<p:piece>
<p:title original="true" xml:lang="ja">
<p:mainTitle>あなたのうまれたのは</p:mainTitle>
</p:title>
</p:piece>
</p:suite-piece>
<p:suite-piece>
<p:piece>
<p:title original="true" xml:lang="ja">
<p:mainTitle>かどで</p:mainTitle>
</p:title>
</p:piece>
</p:suite-piece>
</p:suite>
</free-program>
</program>
</choir>
</section>
</result>
</competition>
